johnhull/references/processed/1999-barone-adesi-giannopoulos-vosper-var-without-correlations/tables/1999-barone-adesi-giannopoulos-vosper-var-without-correlations-p0012-table-0001.json

{
  "cells": [
    {
      "assertion_id": null,
      "cell_type": "data",
      "column": 0,
      "column_span": 1,
      "extractor_numeric_value": null,
      "extractor_raw_text": "Date",
      "manual_correction": false,
      "normalized_text": "Date",
      "numeric_value": null,
      "raw_text": "Date",
      "row": 0,
      "row_span": 1,
      "verification_status": "unverified"
    },
    {
      "assertion_id": null,
      "cell_type": "data",
      "column": 1,
      "column_span": 1,
      "extractor_numeric_value": null,
      "extractor_raw_text": "A",
      "manual_correction": false,
      "normalized_text": "A",
      "numeric_value": null,
      "raw_text": "A",
      "row": 0,
      "row_span": 1,
      "verification_status": "unverified"
    },
    {
      "assertion_id": null,
      "cell_type": "data",
      "column": 2,
      "column_span": 1,
      "extractor_numeric_value": null,
      "extractor_raw_text": "G",
      "manual_correction": false,
      "normalized_text": "G",
      "numeric_value": null,
      "raw_text": "G",
      "row": 0,
      "row_span": 1,
      "verification_status": "unverified"
    },
    {
      "assertion_id": null,
      "cell_type": "data",
      "column": 3,
      "column_span": 1,
      "extractor_numeric_value": null,
      "extractor_raw_text": "S",
      "manual_correction": false,
      "normalized_text": "S",
      "numeric_value": null,
      "raw_text": "S",
      "row": 0,
      "row_span": 1,
      "verification_status": "unverified"
    },
    {
      "assertion_id": null,
      "cell_type": "data",
      "column": 0,
      "column_span": 1,
      "extractor_numeric_value": null,
      "extractor_raw_text": "05/01/94",
      "manual_correction": false,
      "normalized_text": "05/01/94",
      "numeric_value": null,
      "raw_text": "05/01/94",
      "row": 1,
      "row_span": 1,
      "verification_status": "unverified"
    },
    {
      "assertion_id": null,
      "cell_type": "data",
      "column": 1,
      "column_span": 1,
      "extractor_numeric_value": 0.0,
      "extractor_raw_text": "0.00000",
      "manual_correction": false,
      "normalized_text": "0.00000",
      "numeric_value": 0.0,
      "raw_text": "0.00000",
      "row": 1,
      "row_span": 1,
      "verification_status": "unverified"
    },
    {
      "assertion_id": null,
      "cell_type": "data",
      "column": 2,
      "column_span": 1,
      "extractor_numeric_value": 0.0,
      "extractor_raw_text": "0.00000",
      "manual_correction": false,
      "normalized_text": "0.00000",
      "numeric_value": 0.0,
      "raw_text": "0.00000",
      "row": 1,
      "row_span": 1,
      "verification_status": "unverified"
    },
    {
      "assertion_id": null,
      "cell_type": "data",
      "column": 3,
      "column_span": 1,
      "extractor_numeric_value": 0.0,
      "extractor_raw_text": "0.00000",
      "manual_correction": false,
      "normalized_text": "0.00000",
      "numeric_value": 0.0,
      "raw_text": "0.00000",
      "row": 1,
      "row_span": 1,
      "verification_status": "unverified"
    },
    {
      "assertion_id": null,
      "cell_type": "data",
      "column": 0,
      "column_span": 1,
      "extractor_numeric_value": null,
      "extractor_raw_text": "06/01/94",
      "manual_correction": false,
      "normalized_text": "06/01/94",
      "numeric_value": null,
      "raw_text": "06/01/94",
      "row": 2,
      "row_span": 1,
      "verification_status": "unverified"
    },
    {
      "assertion_id": null,
      "cell_type": "data",
      "column": 1,
      "column_span": 1,
      "extractor_numeric_value": -0.15123,
      "extractor_raw_text": "-0.15123",
      "manual_correction": false,
      "normalized_text": "-0.15123",
      "numeric_value": -0.15123,
      "raw_text": "-0.15123",
      "row": 2,
      "row_span": 1,
      "verification_status": "unverified"
    },
    {
      "assertion_id": null,
      "cell_type": "data",
      "column": 2,
      "column_span": 1,
      "extractor_numeric_value": 0.08776,
      "extractor_raw_text": "0.08776",
      "manual_correction": false,
      "normalized_text": "0.08776",
      "numeric_value": 0.08776,
      "raw_text": "0.08776",
      "row": 2,
      "row_span": 1,
      "verification_status": "unverified"
    },
    {
      "assertion_id": null,
      "cell_type": "data",
      "column": 3,
      "column_span": 1,
      "extractor_numeric_value": 0.69159,
      "extractor_raw_text": "0.69159",
      "manual_correction": false,
      "normalized_text": "0.69159",
      "numeric_value": 0.69159,
      "raw_text": "0.69159",
      "row": 2,
      "row_span": 1,
      "verification_status": "unverified"
    },
    {
      "assertion_id": null,
      "cell_type": "data",
      "column": 0,
      "column_span": 1,
      "extractor_numeric_value": null,
      "extractor_raw_text": "07/01/94",
      "manual_correction": false,
      "normalized_text": "07/01/94",
      "numeric_value": null,
      "raw_text": "07/01/94",
      "row": 3,
      "row_span": 1,
      "verification_status": "unverified"
    },
    {
      "assertion_id": null,
      "cell_type": "data",
      "column": 1,
      "column_span": 1,
      "extractor_numeric_value": 0.85533,
      "extractor_raw_text": "0.85533",
      "manual_correction": false,
      "normalized_text": "0.85533",
      "numeric_value": 0.85533,
      "raw_text": "0.85533",
      "row": 3,
      "row_span": 1,
      "verification_status": "unverified"
    },
    {
      "assertion_id": null,
      "cell_type": "data",
      "column": 2,
      "column_span": 1,
      "extractor_numeric_value": 1.25962,
      "extractor_raw_text": "1.25962",
      "manual_correction": false,
      "normalized_text": "1.25962",
      "numeric_value": 1.25962,
      "raw_text": "1.25962",
      "row": 3,
      "row_span": 1,
      "verification_status": "unverified"
    },
    {
      "assertion_id": null,
      "cell_type": "data",
      "column": 3,
      "column_span": 1,
      "extractor_numeric_value": 0.0,
      "extractor_raw_text": "0.00000",
      "manual_correction": false,
      "normalized_text": "0.00000",
      "numeric_value": 0.0,
      "raw_text": "0.00000",
      "row": 3,
      "row_span": 1,
      "verification_status": "unverified"
    },
    {
      "assertion_id": null,
      "cell_type": "data",
      "column": 0,
      "column_span": 1,
      "extractor_numeric_value": null,
      "extractor_raw_text": "10/01/94",
      "manual_correction": false,
      "normalized_text": "10/01/94",
      "numeric_value": null,
      "raw_text": "10/01/94",
      "row": 4,
      "row_span": 1,
      "verification_status": "unverified"
    },
    {
      "assertion_id": null,
      "cell_type": "data",
      "column": 1,
      "column_span": 1,
      "extractor_numeric_value": 0.18241,
      "extractor_raw_text": "0.18241",
      "manual_correction": false,
      "normalized_text": "0.18241",
      "numeric_value": 0.18241,
      "raw_text": "0.18241",
      "row": 4,
      "row_span": 1,
      "verification_status": "unverified"
    },
    {
      "assertion_id": null,
      "cell_type": "data",
      "column": 2,
      "column_span": 1,
      "extractor_numeric_value": -0.32852,
      "extractor_raw_text": "-0.32852",
      "manual_correction": false,
      "normalized_text": "-0.32852",
      "numeric_value": -0.32852,
      "raw_text": "-0.32852",
      "row": 4,
      "row_span": 1,
      "verification_status": "unverified"
    },
    {
      "assertion_id": null,
      "cell_type": "data",
      "column": 3,
      "column_span": 1,
      "extractor_numeric_value": 0.96747,
      "extractor_raw_text": "0.96747",
      "manual_correction": false,
      "normalized_text": "0.96747",
      "numeric_value": 0.96747,
      "raw_text": "0.96747",
      "row": 4,
      "row_span": 1,
      "verification_status": "unverified"
    },
    {
      "assertion_id": null,
      "cell_type": "data",
      "column": 0,
      "column_span": 1,
      "extractor_numeric_value": null,
      "extractor_raw_text": "11/01/94",
      "manual_correction": false,
      "normalized_text": "11/01/94",
      "numeric_value": null,
      "raw_text": "11/01/94",
      "row": 5,
      "row_span": 1,
      "verification_status": "unverified"
    },
    {
      "assertion_id": null,
      "cell_type": "data",
      "column": 1,
      "column_span": 1,
      "extractor_numeric_value": -0.24443,
      "extractor_raw_text": "-0.24443",
      "manual_correction": false,
      "normalized_text": "-0.24443",
      "numeric_value": -0.24443,
      "raw_text": "-0.24443",
      "row": 5,
      "row_span": 1,
      "verification_status": "unverified"
    },
    {
      "assertion_id": null,
      "cell_type": "data",
      "column": 2,
      "column_span": 1,
      "extractor_numeric_value": -0.94479,
      "extractor_raw_text": "-0.94479",
      "manual_correction": false,
      "normalized_text": "-0.94479",
      "numeric_value": -0.94479,
      "raw_text": "-0.94479",
      "row": 5,
      "row_span": 1,
      "verification_status": "unverified"
    },
    {
      "assertion_id": null,
      "cell_type": "data",
      "column": 3,
      "column_span": 1,
      "extractor_numeric_value": -0.58417,
      "extractor_raw_text": "-0.58417",
      "manual_correction": false,
      "normalized_text": "-0.58417",
      "numeric_value": -0.58417,
      "raw_text": "-0.58417",
      "row": 5,
      "row_span": 1,
      "verification_status": "unverified"
    },
    {
      "assertion_id": null,
      "cell_type": "data",
      "column": 0,
      "column_span": 1,
      "extractor_numeric_value": null,
      "extractor_raw_text": "12/01/94",
      "manual_correction": false,
      "normalized_text": "12/01/94",
      "numeric_value": null,
      "raw_text": "12/01/94",
      "row": 6,
      "row_span": 1,
      "verification_status": "unverified"
    },
    {
      "assertion_id": null,
      "cell_type": "data",
      "column": 1,
      "column_span": 1,
      "extractor_numeric_value": 0.2911,
      "extractor_raw_text": "0.29110",
      "manual_correction": false,
      "normalized_text": "0.29110",
      "numeric_value": 0.2911,
      "raw_text": "0.29110",
      "row": 6,
      "row_span": 1,
      "verification_status": "unverified"
    },
    {
      "assertion_id": null,
      "cell_type": "data",
      "column": 2,
      "column_span": 1,
      "extractor_numeric_value": 0.27269,
      "extractor_raw_text": "0.27269",
      "manual_correction": false,
      "normalized_text": "0.27269",
      "numeric_value": 0.27269,
      "raw_text": "0.27269",
      "row": 6,
      "row_span": 1,
      "verification_status": "unverified"
    },
    {
      "assertion_id": null,
      "cell_type": "data",
      "column": 3,
      "column_span": 1,
      "extractor_numeric_value": -0.41143,
      "extractor_raw_text": "-0.41143",
      "manual_correction": false,
      "normalized_text": "-0.41143",
      "numeric_value": -0.41143,
      "raw_text": "-0.41143",
      "row": 6,
      "row_span": 1,
      "verification_status": "unverified"
    },
    {
      "assertion_id": null,
      "cell_type": "data",
      "column": 0,
      "column_span": 1,
      "extractor_numeric_value": null,
      "extractor_raw_text": "13/01/94|",
      "manual_correction": false,
      "normalized_text": "13/01/94|",
      "numeric_value": null,
      "raw_text": "13/01/94|",
      "row": 7,
      "row_span": 1,
      "verification_status": "unverified"
    },
    {
      "assertion_id": null,
      "cell_type": "data",
      "column": 1,
      "column_span": 1,
      "extractor_numeric_value": -1.15592,
      "extractor_raw_text": "-1.15592",
      "manual_correction": false,
      "normalized_text": "-1.15592",
      "numeric_value": -1.15592,
      "raw_text": "-1.15592",
      "row": 7,
      "row_span": 1,
      "verification_status": "unverified"
    },
    {
      "assertion_id": null,
      "cell_type": "data",
      "column": 2,
      "column_span": 1,
      "extractor_numeric_value": -1.13077,
      "extractor_raw_text": "-1.13077",
      "manual_correction": false,
      "normalized_text": "-1.13077",
      "numeric_value": -1.13077,
      "raw_text": "-1.13077",
      "row": 7,
      "row_span": 1,
      "verification_status": "unverified"
    },
    {
      "assertion_id": null,
      "cell_type": "data",
      "column": 3,
      "column_span": 1,
      "extractor_numeric_value": 0.86704,
      "extractor_raw_text": "0.86704",
      "manual_correction": false,
      "normalized_text": "0.86704",
      "numeric_value": 0.86704,
      "raw_text": "0.86704",
      "row": 7,
      "row_span": 1,
      "verification_status": "unverified"
    },
    {
      "assertion_id": null,
      "cell_type": "data",
      "column": 0,
      "column_span": 1,
      "extractor_numeric_value": null,
      "extractor_raw_text": "14/01/94",
      "manual_correction": false,
      "normalized_text": "14/01/94",
      "numeric_value": null,
      "raw_text": "14/01/94",
      "row": 8,
      "row_span": 1,
      "verification_status": "unverified"
    },
    {
      "assertion_id": null,
      "cell_type": "data",
      "column": 1,
      "column_span": 1,
      "extractor_numeric_value": -0.77676,
      "extractor_raw_text": "-0.77676",
      "manual_correction": false,
      "normalized_text": "-0.77676",
      "numeric_value": -0.77676,
      "raw_text": "-0.77676",
      "row": 8,
      "row_span": 1,
      "verification_status": "unverified"
    },
    {
      "assertion_id": null,
      "cell_type": "data",
      "column": 2,
      "column_span": 1,
      "extractor_numeric_value": -0.35823,
      "extractor_raw_text": "-0.35823",
      "manual_correction": false,
      "normalized_text": "-0.35823",
      "numeric_value": -0.35823,
      "raw_text": "-0.35823",
      "row": 8,
      "row_span": 1,
      "verification_status": "unverified"
    },
    {
      "assertion_id": null,
      "cell_type": "data",
      "column": 3,
      "column_span": 1,
      "extractor_numeric_value": 0.65085,
      "extractor_raw_text": "0.65085",
      "manual_correction": false,
      "normalized_text": "0.65085",
      "numeric_value": 0.65085,
      "raw_text": "0.65085",
      "row": 8,
      "row_span": 1,
      "verification_status": "unverified"
    },
    {
      "assertion_id": null,
      "cell_type": "data",
      "column": 0,
      "column_span": 1,
      "extractor_numeric_value": null,
      "extractor_raw_text": "17/01/94",
      "manual_correction": false,
      "normalized_text": "17/01/94",
      "numeric_value": null,
      "raw_text": "17/01/94",
      "row": 9,
      "row_span": 1,
      "verification_status": "unverified"
    },
    {
      "assertion_id": null,
      "cell_type": "data",
      "column": 1,
      "column_span": 1,
      "extractor_numeric_value": -0.38586,
      "extractor_raw_text": "-0.38586",
      "manual_correction": false,
      "normalized_text": "-0.38586",
      "numeric_value": -0.38586,
      "raw_text": "-0.38586",
      "row": 9,
      "row_span": 1,
      "verification_status": "unverified"
    },
    {
      "assertion_id": null,
      "cell_type": "data",
      "column": 2,
      "column_span": 1,
      "extractor_numeric_value": 0.27006,
      "extractor_raw_text": "0.27006",
      "manual_correction": false,
      "normalized_text": "0.27006",
      "numeric_value": 0.27006,
      "raw_text": "0.27006",
      "row": 9,
      "row_span": 1,
      "verification_status": "unverified"
    },
    {
      "assertion_id": null,
      "cell_type": "data",
      "column": 3,
      "column_span": 1,
      "extractor_numeric_value": -0.22329,
      "extractor_raw_text": "-0.22329",
      "manual_correction": false,
      "normalized_text": "-0.22329",
      "numeric_value": -0.22329,
      "raw_text": "-0.22329",
      "row": 9,
      "row_span": 1,
      "verification_status": "unverified"
    },
    {
      "assertion_id": null,
      "cell_type": "data",
      "column": 0,
      "column_span": 1,
      "extractor_numeric_value": null,
      "extractor_raw_text": "18/01/94",
      "manual_correction": false,
      "normalized_text": "18/01/94",
      "numeric_value": null,
      "raw_text": "18/01/94",
      "row": 10,
      "row_span": 1,
      "verification_status": "unverified"
    },
    {
      "assertion_id": null,
      "cell_type": "data",
      "column": 1,
      "column_span": 1,
      "extractor_numeric_value": 0.32893,
      "extractor_raw_text": "0.32893",
      "manual_correction": false,
      "normalized_text": "0.32893",
      "numeric_value": 0.32893,
      "raw_text": "0.32893",
      "row": 10,
      "row_span": 1,
      "verification_status": "unverified"
    },
    {
      "assertion_id": null,
      "cell_type": "data",
      "column": 2,
      "column_span": 1,
      "extractor_numeric_value": 1.20579,
      "extractor_raw_text": "1.20579",
      "manual_correction": false,
      "normalized_text": "1.20579",
      "numeric_value": 1.20579,
      "raw_text": "1.20579",
      "row": 10,
      "row_span": 1,
      "verification_status": "unverified"
    },
    {
      "assertion_id": null,
      "cell_type": "data",
      "column": 3,
      "column_span": 1,
      "extractor_numeric_value": -0.23623,
      "extractor_raw_text": "-0.23623",
      "manual_correction": false,
      "normalized_text": "-0.23623",
      "numeric_value": -0.23623,
      "raw_text": "-0.23623",
      "row": 10,
      "row_span": 1,
      "verification_status": "unverified"
    },
    {
      "assertion_id": null,
      "cell_type": "data",
      "column": 0,
      "column_span": 1,
      "extractor_numeric_value": null,
      "extractor_raw_text": "",
      "manual_correction": false,
      "normalized_text": "",
      "numeric_value": null,
      "raw_text": "",
      "row": 11,
      "row_span": 1,
      "verification_status": "unverified"
    },
    {
      "assertion_id": null,
      "cell_type": "data",
      "column": 1,
      "column_span": 1,
      "extractor_numeric_value": null,
      "extractor_raw_text": "",
      "manual_correction": false,
      "normalized_text": "",
      "numeric_value": null,
      "raw_text": "",
      "row": 11,
      "row_span": 1,
      "verification_status": "unverified"
    },
    {
      "assertion_id": null,
      "cell_type": "data",
      "column": 2,
      "column_span": 1,
      "extractor_numeric_value": null,
      "extractor_raw_text": "",
      "manual_correction": false,
      "normalized_text": "",
      "numeric_value": null,
      "raw_text": "",
      "row": 11,
      "row_span": 1,
      "verification_status": "unverified"
    },
    {
      "assertion_id": null,
      "cell_type": "data",
      "column": 3,
      "column_span": 1,
      "extractor_numeric_value": null,
      "extractor_raw_text": "",
      "manual_correction": false,
      "normalized_text": "",
      "numeric_value": null,
      "raw_text": "",
      "row": 11,
      "row_span": 1,
      "verification_status": "unverified"
    },
    {
      "assertion_id": null,
      "cell_type": "data",
      "column": 0,
      "column_span": 1,
      "extractor_numeric_value": null,
      "extractor_raw_text": "13/11/95",
      "manual_correction": false,
      "normalized_text": "13/11/95",
      "numeric_value": null,
      "raw_text": "13/11/95",
      "row": 12,
      "row_span": 1,
      "verification_status": "unverified"
    },
    {
      "assertion_id": null,
      "cell_type": "data",
      "column": 1,
      "column_span": 1,
      "extractor_numeric_value": 0.93074,
      "extractor_raw_text": "0.93074",
      "manual_correction": false,
      "normalized_text": "0.93074",
      "numeric_value": 0.93074,
      "raw_text": "0.93074",
      "row": 12,
      "row_span": 1,
      "verification_status": "unverified"
    },
    {
      "assertion_id": null,
      "cell_type": "data",
      "column": 2,
      "column_span": 1,
      "extractor_numeric_value": 0.43796,
      "extractor_raw_text": "0.43796",
      "manual_correction": false,
      "normalized_text": "0.43796",
      "numeric_value": 0.43796,
      "raw_text": "0.43796",
      "row": 12,
      "row_span": 1,
      "verification_status": "unverified"
    },
    {
      "assertion_id": null,
      "cell_type": "data",
      "column": 3,
      "column_span": 1,
      "extractor_numeric_value": -0.72107,
      "extractor_raw_text": "-0.72107",
      "manual_correction": false,
      "normalized_text": "-0.72107",
      "numeric_value": -0.72107,
      "raw_text": "-0.72107",
      "row": 12,
      "row_span": 1,
      "verification_status": "unverified"
    },
    {
      "assertion_id": null,
      "cell_type": "data",
      "column": 0,
      "column_span": 1,
      "extractor_numeric_value": null,
      "extractor_raw_text": "",
      "manual_correction": false,
      "normalized_text": "",
      "numeric_value": null,
      "raw_text": "",
      "row": 13,
      "row_span": 1,
      "verification_status": "unverified"
    },
    {
      "assertion_id": null,
      "cell_type": "data",
      "column": 1,
      "column_span": 1,
      "extractor_numeric_value": null,
      "extractor_raw_text": "",
      "manual_correction": false,
      "normalized_text": "",
      "numeric_value": null,
      "raw_text": "",
      "row": 13,
      "row_span": 1,
      "verification_status": "unverified"
    },
    {
      "assertion_id": null,
      "cell_type": "data",
      "column": 2,
      "column_span": 1,
      "extractor_numeric_value": null,
      "extractor_raw_text": "",
      "manual_correction": false,
      "normalized_text": "",
      "numeric_value": null,
      "raw_text": "",
      "row": 13,
      "row_span": 1,
      "verification_status": "unverified"
    },
    {
      "assertion_id": null,
      "cell_type": "data",
      "column": 3,
      "column_span": 1,
      "extractor_numeric_value": null,
      "extractor_raw_text": "",
      "manual_correction": false,
      "normalized_text": "",
      "numeric_value": null,
      "raw_text": "",
      "row": 13,
      "row_span": 1,
      "verification_status": "unverified"
    },
    {
      "assertion_id": null,
      "cell_type": "data",
      "column": 0,
      "column_span": 1,
      "extractor_numeric_value": null,
      "extractor_raw_text": "21/02/96",
      "manual_correction": false,
      "normalized_text": "21/02/96",
      "numeric_value": null,
      "raw_text": "21/02/96",
      "row": 14,
      "row_span": 1,
      "verification_status": "unverified"
    },
    {
      "assertion_id": null,
      "cell_type": "data",
      "column": 1,
      "column_span": 1,
      "extractor_numeric_value": 0.40954,
      "extractor_raw_text": "0.40954",
      "manual_correction": false,
      "normalized_text": "0.40954",
      "numeric_value": 0.40954,
      "raw_text": "0.40954",
      "row": 14,
      "row_span": 1,
      "verification_status": "unverified"
    },
    {
      "assertion_id": null,
      "cell_type": "data",
      "column": 2,
      "column_span": 1,
      "extractor_numeric_value": 1.01243,
      "extractor_raw_text": "1.01243",
      "manual_correction": false,
      "normalized_text": "1.01243",
      "numeric_value": 1.01243,
      "raw_text": "1.01243",
      "row": 14,
      "row_span": 1,
      "verification_status": "unverified"
    },
    {
      "assertion_id": null,
      "cell_type": "data",
      "column": 3,
      "column_span": 1,
      "extractor_numeric_value": 0.085935,
      "extractor_raw_text": "0.085935",
      "manual_correction": false,
      "normalized_text": "0.085935",
      "numeric_value": 0.085935,
      "raw_text": "0.085935",
      "row": 14,
      "row_span": 1,
      "verification_status": "unverified"
    }
  ]
}

johnhull/references/processed/1999-barone-adesi-giannopoulos-vosper-var-without-correlations/paper.md

## 3 AN EMPIRICAL INVESTIGATION

• Let us assume that the random set of standardised residuals are : -1.15592, -1.13077 and 0.86704

We repeat the above calculations to get the N days ahead forecasts of the variances and prices for each of the three futures contracts. For example to obtain the 2 day ahead price forecasts: we randomly sample another row with historical standardised residuals, for each of the three contracts. Let us assume that this random set corresponds to November 13, 1995, and the values are 0.93074, 0.43796, -0.72107, for A, G and S respectively. When these random historical standardised residuals are re-scaled by the day 2 simulated volatilities the following set of scaled residuals are produced: